{
  "block": "block1_relevance",
  "report_type": "market",
  "mode": "template",
  "top_n": 5,
  "enrich_with_perplexity": true,
  "perplexity_model": "sonar",
  "source_csv": "/Users/danilapertsev/Desktop/ms_v2/final_blyat_v3.csv",
  "query_context": "Типы заведений: ресторан, премиум-ресторан. Кухни: русская, европейская. Диапазон среднего чека: 2000-5000₽. Особенности: панорамный вид, авторская кухня, центр Москвы.",
  "общий_вывод": "Выборка формируется вокруг ресторанов среднего и премиального сегмента в центре Москвы, где пересекаются русская и европейская кухни, но сами форматы внутри ниши неоднородны. Часть игроков выглядит как ярко выраженные гастрономические проекты с сильной цифровой опорой, а часть держится скорее на бренде и локации, чем на полноте сервисных атрибутов.",
  "selected_places": [
    {
      "название": "Gussi",
      "адрес": "ул. Никольская, 12",
      "тип_заведения": "винотека, ресторан",
      "кухня": "авторская, европейская, русская",
      "средний_чек": 4000,
      "описание": "Ресторан авторской русской кухни в центре Москвы с выразительным интерьером и акцентом на блюда из птицы.",
      "ссылка": "https://www.restoclub.ru/msk/place/gussi-2",
      "cosine_score": 0.65,
      "сайт": "https://www.gussi-gussi.com/moscow",
      "доставка": true,
      "время_работы": "Ежедневно 12:00-24:00",
      "вывод": "Gussi в этой выборке считывается как современный городской ресторан с авторской интерпретацией русской кухни и уверенным средним чеком. Наличие собственного сайта, доставки и подтвержденного режима работы делает его одним из наиболее полно упакованных игроков внутри ниши."
    },
    {
      "название": "Savoy",
      "адрес": "ул. Рождественка, 3/6с1",
      "тип_заведения": "премиум-ресторан, ресторан",
      "кухня": "европейская, русская",
      "средний_чек": 4500,
      "описание": "Исторический ресторан с премиальным позиционированием и фокусом на русско-французскую гастрономию.",
      "ссылка": "https://www.restoclub.ru/msk/place/savoj",
      "cosine_score": 0.61,
      "сайт": "https://savoy.rest",
      "доставка": null,
      "время_работы": "Ежедневно 08:00-23:00",
      "вывод": "Savoy занимает более классическую премиальную позицию: исторический ресторан с высоким чеком и сильной статусной подачей. При этом по подтвержденным сервисным атрибутам он выглядит менее прозрачным, чем часть более цифрово упакованных конкурентов."
    }
  ]
}
